[
  {
    "$schema": "../../source/schemas/feedback-schema.json",
    "meta": {
      "feedbackId": "FDB-20251003-103008-001-QWERT",
      "type": "feedback",
      "version": 1.0,
      "flags": {
        "reviewed": true,
        "resolved": true,
        "archived": false,
        "guest": false      },
      "links": {
        "userId": "USR-20251002-170603-103-CDEF",
        "merchantId": null
      }
    },
    "submitter": {
      "id": "USR-20251002-170603-103-CDEF",
      "role": "consumer",
      "submittedAt": "2025-10-03T10:30:00Z"
    },
    "details": {
      "subject": "Search Feature Improvement",
      "message": "App bahut accha hai, lekin search feature ko improve kiya ja sakta hai.",
      "category": "feature_request",
      "sentiment": "positive",
      "attachments": [],
      "phone": "+919876543210"
    },
    "lifecycle": {
      "status": "resolved",
      "milestones": {
        "reviewedAt": "2025-10-03T11:00:00Z",
        "resolvedAt": "2025-10-03T15:20:00Z",
        "archivedAt": null
      },
      "history": [
        {
          "from": "pending",
          "to": "reviewed",
          "updatedAt": "2025-10-03T11:00:00Z",
          "updatedBy": { "id": "USR-20251002-170601-101-ABCD", "role": "admin" },
          "note": "Admin reviewed feedback."
        },
        {
          "from": "reviewed",
          "to": "resolved",
          "updatedAt": "2025-10-03T15:20:00Z",
          "updatedBy": { "id": "USR-20251002-170601-101-ABCD", "role": "admin" },
          "note": "Issue resolved and marked as complete."
        }
      ]
    }
  }
]